Sentence	Entity	Entity(JA)	Eno.	Event	Bel(A)R	Bel(B)R	CG(A)R	CG(B)R	Pragmatics	Bel(A)	Bel(B)	CG(A)	CG(B)	Why(CG)	Why in prose	Comment
A: Stopping with the miscarriage anxiety starting with the delivery anxiety.  [[said laughing]] 			208.1	A is stopping with the miscarriage anxiety					A laughs about 208.1 and 208.2	PS 208.1	PS 208.1	JA 208.1	JA 208.1	C	A laughs at events in 208 which suggests that A does not express certain belief in those	
			208.2	A is starinng with the delivery anxiety						PS 208.2	PS 208.2	JA 208.2	JA 208.2			
B: {laugh} I know oh no. I had the miscarriage anxiety up until the you know because you have all those well wishers you know telling you about all those things you know.  	I=B,you=one		209.1	B had the miscarriage anxiety up until the delivery because one has all those wishers telling one about all those things					I know oh no=B emphatizes  with A about the pregnany  related anxieties	CT+ 209.1	CT+ 209.1	JA 209.1	JA 209.1			
			209.2	B had the miscarriage anxiety up until the delivery						CT+ 209.2	CT+ 209.2	JA 209.2	JA 209.2			
			209.3	One has all those wishers telling one about all those things						CT+ 209.3	CT+ 209.3	JA 209.3	JA 209.3			
A: ooh everybody wants to start telling you these things like people would like corner me to tell me about their hysterectomies. It’s like somehow some O B gyn connection that they see you and they think of O B gyn and they’ve got to tell you about it.  	you=one,their=people's,me=A,they=people,you 2=pregnant woman		210.1	Everybody wants to start telling one about their pregnancy experience						CT+ 210.1	CT+ 210.1	JA 210.1	JA 210.1			
			210.2	People would corner A to tell A about people's hysterectomies						CT+ 210.2	CT+ 210.2	JA 210.2	JA 210.2			
			210.3	People would corner A						NB 210.3	NB 210.3					
			210.4	People would tell A about people's hysterectomies						CT+ 210.4	CT+ 210.4	JA 210.4	JA 210.4			
			210.5	People had hysterectomies						CT+ 210.5	CT+ 210.5	IN 210.5	IN 210.5	C	presupposed	
			210.6	When people see a pregnant woman, the people think of OB gyn						CT+ 210.6	CT+ 210.6	JA 210.6	JA 210.6			
			210.7	People see a pregnant woman						NB 210.7	NB 210.7					
			210.8	People think of OB gyn						NB 210.8	NB 210.8					
			210.9	People who think of OB gyn when seeing a pregnant woman got to tell the pregnant woman about the people's hysterectomies						CT+ 210.9	CT+ 210.9	JA 210.9	JA 210.9			
B: oh my god.  			211						oh my god=B expresses annoyance about 210							
B: you know [distorted] 			212						you know=interjection							
B: yeah 			213						yeah=interjection							
B: Well I’ve heard the cord accident stories 	I=B		214	B's heard the cord accident stories					well=interjection	CT+ 214	CT+ 214	JA 214	JA 214			
B: which had me like totally and completely freaked out.  	which=the cord accident stories,me=B		215	The cord accident stories had B totally and completely freaked out					like=interjection	CT+ 215	CT+ 215	JA 215	JA 215			
B: a- are you still there? 	you=A,there=on the phone		216.1	B asks A if A is still on the phone						CT+ 216.1	CT+ 216.1	JA 216.1	JA 216.1			
			216.2	A is still on the phone	 → 217 CT+		 → 217 JA	 → 217 CT+		NB 216.2	CT+ 216.2					
A: yeah ((I’m still here)) [distortion] 			217							CT+ 216.2		JA 216.2	JA 216.2			
B: oh so I had so I talked to my doctor about it and apparently it’s very rare [[said laughing]] so don’t ask me why I’ve heard so many stories about it but {sniff} 	I=B,me=B,it=the cord accidents,my=B's		218.1	B talked to B's doctor about the cord accidents						CT+ 218.1	CT+ 218.1	JA 218.1	JA 218.1			
			218.2	The cord accidents are apparently very rare						CT+ 218.2	CT+ 218.2	JA 218.2	JA 218.2			
			218.3	B requests A not to ask B why B's heard so many stories about the cord accidents						CT+ 218.3	CT+ 218.3	JA 218.3	JA 218.3			
			218.4	A asks B why B's heard so many stories about the cord accidents						CT- 218.4	CT- 218.4	RT 218.4	RT 218.4			
			218.5	B's heard so many stories about the cord accidents						CT+ 218.5	CT+ 218.5	IN 218.5	IN 218.5	C	implied from events in 214, 218.1	
B: oh yeah and then there was this friend I had she was eight and a half months pregnant and you know {breath} baby had a cord accident and she died. [[said laughing]] 	I=B,she=B's friend,she 2=B's friend's baby		219.1	There was B's friend that B had					oh yeah=B remembers a story about the cord accidents	CT+ 219.1	CT+ 219.1	JA 219.1	JA 219.1			
			219.2	B had a friend					you know=interjection	CT+ 219.2	CT+ 219.2	JA 219.2	JA 219.2	C	presupposition accomodation	
			219.3	B's friend was eight and a half months pregnant						CT+ 219.3	CT+ 219.3	JA 219.3	JA 219.3			
			219.4	B's friend's baby had a cord accident						CT+ 219.4	CT+ 219.4	JA 219.4	JA 219.4			
			219.5	B's friend's baby died						CT+ 219.5	CT+ 219.5	JA 219.5	JA 219.5			
A: Like most people they just have babies it all works out.  			220.1	It all works out for most people who have babies			 → 221.1 IN	 → 221.1 CT-		CT+ 220.1	CT+ 220.1	JA 220.1	JA 220.1			
			220.2	People have babies						NB 220.2	NB 220.2					
B: yeah. I know. I know so I’m not so freaked out anymore.  	I=B		221.1	B knows 220.1						CT+ 221.1	CT+ 221.1	JA 221.1,IN 220.1	JA 221.1,IN 220.1			
			221.2	B is not so freaked out anymore						CT+ 221.2	CT+ 221.2	JA 221.2	JA 221.2			
A: Good.  			222						Good=A is happy that 221.2							
B: {lipsmack} That was like I was talking to &Erica on the phone and %uh 	I=B,Erica	Erica	223	B was talking to Erica on the phone						CT+ 223	CT+ 223	JA 223	JA 223			
B: that’s what she told me she’s like but d- to say that it was okay she was like saying that well you know but this woman is pregnant again and you know will have her baby again soon so it was like no big deal. 	she=Erica,it=loosing Erica's baby,woman=B's friend who lost the child,her=B's friend who lost the child's		224.1	Erica told B that B's friend loosing B's friend baby was okay						CT+ 224.1	CT+ 224.1	JA 224.1	JA 224.1			
			224.2	B's friend loosing B's friend baby was okay						CT- 224.2	CT- 224.2	RT 224.2	RT 224.2	C	 In 227.1 B disagrees, and 228 A does	
			224.3	B's friend is pregnant again					like = interjection	CT+ 224.3	CT+ 224.3	JA 224.3	JA 224.3			
			224.4	B's friend will have B's friend baby again soon so B's friend's loosing B's friend's baby was no big deal					you know= interjection	CT+ 224.4	CT+ 224.4	JA 224.4	JA 224.4			
			224.5	B's friend will have B's friend baby again soon 						CT+ 224.5	CT+ 224.5	JA 224.5	JA 224.5			
			224.6	B's friend's loosing B's friend's baby was no big deal						CT- 224.6	CT- 224.6	RT 224.6	RT 224.6	C	 In 227.1 B disagrees, and 228 A does	
A: No yeah.  			225						No yeah= A agrees with 224							
B: But having never been pregnant before, you know I’m sure &Erica has like no idea this woman must be on just you know absolute.  	I=B,woman=B's friend who lost the baby		226	 					you know=interjection; like = interjection							
B: pins and needles.  She must be having the most miserable pregnancy in the whole world.  	She=B's friend		227.1	But having never been pregnant before, B's sure Erica has no idea B's friend must be on just absolute pins and needles						CT+ 227.1	CT+ 227.1	JA 227.1	JA 227.1			
			227.2	Erica has never been pregnant before						CT+ 227.2	CT+ 227.2	JA 227.2	JA 227.2	C	presupposition accommodation	
			227.3	B is sure Erica has no idea B's friend must be on just absolute pins and needles						CT+ 227.3	CT+ 227.3	JA 227.3	JA 227.3			
			227.4	Erica has no idea B's friend must be on just absolute pins and needles						CT+ 227.4	CT+ 227.4	JA 227.4	JA 227.4			
			227.5	B's friend must be on just absolute pins and needles						CT+ 227.5	CT+ 227.5	JA 227.5	JA 227.5			
			227.6	B's friend is on just absolute pins and needles						PS 227.6	PS 227.6	JA 227.6	JA 227.6	LI	embedded under must -- indicates less than certain belief (???)	
			227.7	B's friend must be having the most miserable pregnancy in the whole world						CT+ 227.7	CT+ 227.7	JA 227.7	JA 227.7			
			227.8	B's friend is having the most miserable pregnancy in the whole world						PS 227.8	PS 227.8	JA 227.8	JA 227.8			
A: yeah that’s such a public thing.  Like everyone knew she was pregnant.  I mean once you’re eight and half months, man, I mean there was nothing nice about it (( )) 	that=loosing a baby,she=B's friend,I=A,you=one		228.1	Loosing a baby is such a public thing					like=interjection	CT+ 228.1	CT+ 228.1	JA 228.1	JA 228.1			
			228.2	Everyone knew B's friend was pregnant						CT+ 228.2	CT+ 228.2	JA 228.2	JA 228.2			
			228.3	B's friend was pregnant					I mean= (???)	CT+ 228.3	CT+ 228.3	IN 228.3	IN 228.3	LI	embeded under 'know	
			228.4	There was nothing nice about being pregnant eight and half months and loosing the baby			 → 229 IN	 → 229 CT-	man=expression of empathy	CT+ 228.4	CT+ 228.4	JA 228.4	JA 228.4			
			228.5	There was nothing nice about being pregnant eight and half months						CT+ 228.5	CT+ 228.5	JA 228.5	JA 228.5			
			228.6	There was nothing nice about loosing the baby						CT+ 228.6	CT+ 228.6	JA 228.6	JA 228.6			
B: I know.  	I=B		229	B knows 228.4						CT+ 229	CT+ 229	JA 229,IN 228.4	JA 229,IN 228.4			
A: you know if you’ve made it through the eight and a half months, man, you deserve it a baby.  	you=one		230.1	If one's made it through the eight and a half months, one deserves a baby			 → 232.1 IN	 → 232.1 CT-	you know=interjection	CT+ 230.1	CT+ 230.1	JA 230.1	JA 230.1			
			230.2	One's made it through the eight and a half months						NB 230.2	NB 230.2					
			230.3	One deserves a baby						NB 230.3	NB 230.3					
B: I bet [distorted] 			231													
B: I know and then you know and then to have to go back to work 	I=B		232.1	B knows 230.1						CT+ 232.1	CT+ 232.1	JA 232.1,IN 230.1	JA 232.1,IN 230.1			
			232.2	One has to go back to work after one looses one's baby						CT+ 232.2	CT+ 232.2	JA 232.2	JA 232.2			
			232.3	Going back to work after loosing one's baby is tough						CT+ 232.3	CT+ 232.3	JA 232.3	JA 232.3	C	implication	
B: and {inhale} you know and then the second pregnancy must be just like fraught with anxiety and especially since it happened at eight and a half months, you know.   	it=loosing the baby		233.1	Once one lost baby at eight and a half months, the second pregnancy must be just like fraught with anxiety					you know=interjection	CT+ 233.1	CT+ 233.1	JA 233.1	JA 233.1			
			233.2	One lost baby at eight and a half months						NB 233.2	NB 233.2					
			233.3	The second pregnancy must be just like fraught with anxiety						NB 233.3	NB 233.3					
A: yeah and everybody is probably saying now you better really drink milk this time.  You better eat your cottage cheese now.  	you=one,You=one		234.1	Everybody is probably saying now one better really drink milk this time			 → 235 IN	 → 235 CT-	yeah=A agrees with 233.1	CT+ 234.1	CT+ 234.1	JA 234.1	JA 234.1			
			234.2	Now one better really drink milk this time						CT+ 234.2	CT+ 234.2	JA 234.2	JA 234.2			
			234.3	One really drinks milk this time						CT- 234.3	CT- 234.3	RT 234.3	RT 234.3	C	 suggestion for future, does not suggest that the event is true now	
			234.4	One better eat one's cottage cheese now						CT+ 234.4	CT+ 234.4	JA 234.4	JA 234.4			
			234.5	One eats one's cottage cheese now						CT- 234.5	CT- 234.5	RT 234.5	RT 234.5	C	 suggestion for future, does not suggest that the event is true now	
B: {laugh} I Know.  			235	B knows 234.1						CT+ 235	CT+ 235	JA 235,IN 234.1	JA 235,IN 234.1			
B: I know I know yeah.  I actually did start drinking more milk and it has helped with all my little aches and pains and stuff.  	I=B,it=drinking more milk,my=B's		236.1	B actually did start drinking more milk						CT+ 236.1	CT+ 236.1	JA 236.1	JA 236.1			
