Sentence	Entity	Entity(JA)	Eno.	Event	Bel(A)R	Bel(B)R	CG(A)R	CG(B)R	Pragmatics	Bel(A)	Bel(B)	CG(A)	CG(B)	Why(CG)	Why in prose	Comment
B: yeah so yeah I’ve been there like {laugh} five or six times 	I=B,there=national park?		1						yeah=agreement							
A: Wow.  			2						wow=amazement							
B: because I drove across the country three times. I’ve been there wait, yes three times I think.  	I=B		3.1	B has been in the national park like five or six times because B drove across the country three times	 → 3.5 CT-	 → 3.5 CT-	 → 3.5 RT	 → 3.5 PS	(because=self talk)	CT+ 3.1	CT+ 3.1	JA 3.1	JA 3.1			
			3.2	B has been in the national park like five or six times	 → 3.5 CT-	 → 3.5 CT-	 → 3.5 RT			CT+ 3.2	PS 3.2	JA 3.2	RT 3.2			
			3.3	B drove acress the country three times					wait=self correction	CT+ 3.3	CT+ 3.3	JA 3.3	JA 3.3			
			3.4	B thinks that B has been in the national park three times						CT+ 3.4	CT+ 3.4	JA 3.4	JA 3.4			
			3.5	B has been in the national park three times						PS 3.5,CT- 3.2,CT- 3.1	PS 3.5,CT- 3.2,CT- 3.1	JA 3.5,RT 3.2,RT 3.1	JA 3.5,RT 3.1			
A: Well this is our second time.  	our=A's and Kevin's		4	This is A's and Kevin's second time in the national park.  					well=transition marker	CT+ 4	CT+ 4	JA 4	JA 4			
B: yeah.  			5						yeah=sustaining conversation(backchannel)							
A: The first time we had been it was like twelve years ago &Kevin and I went on like a six week camping trip you know we hit -- 	Kevin=A'a husband?,I=A,we=A and Kevin,you=one		6.1	The first time Kevin and A had been in the national park was like twelve year ago					like=filler	CT+ 6.1	CT+ 6.1	JA 6.1	JA 6.1			
			6.2	Kevin and A went on like six week campin trip					you know=filler	CT+ 6.2	CT+ 6.2	JA 6.2	JA 6.2			
B: %uh that must have been fun.  	that=the six week camping trip		7	The camping trip must have been fun						CT+ 7	CT+ 7	JA 7	JA 7			
A: -- You know &Washington, we hit you know from &Idaho to &Washington we hit all kinds of national parks and stu- [distortion].  	we=A and Kevin,You=one		8	A and Kevin hit all kinds of national parks from Idaho to Washington						CT+ 8	CT+ 8	JA 8	JA 8			
B: uh-huh.  			9						uh-huh=agreement with 8.1							
B: oh yeah it’s so beautiful %huh.  	it=national park?		10	National parks are so beautiful.						CT+ 10	CT+ 10	JA 10	JA 10			
A: And you know 			11													
A: You know we spent a l- you know couple days in &Yellowstone and then 	we=A and Kevin,Yellowstone,You=one		12	Kevin and A spent a couple days in Yellowstone					you know=filler	CT+ 12	CT+ 12	JA 12	JA 12			
A: you know a very little time in &Grand &Tetons but we spent a lot of time in the national forests right around there because we (( )) [distorted] you know we were really camping and really serious-- 	there=Grand Tetons,we=A and Kevin		13.1	Kevin and A spent a little time in Grand Tetons						CT+ 13.1	CT+ 13.1	JA 13.1	JA 13.1			
			13.2	Kevin and A spent a lot of time in the forests right around Grand Tetons because Kevin and A were really camping and really serious						CT+ 13.2	CT+ 13.2	JA 13.2	JA 13.2			
			13.3	Kevin and A spent a lot of time in the forests right around Grand Tetons						CT+ 13.3	CT+ 13.3	JA 13.3	JA 13.3			
			13.4	Kevin and A were really camping and really serious						CT+ 13.4	CT+ 13.4	JA 13.4	JA 13.4			
B: uh-huh.  			14						uh-huh=filler							
B: mhm.  			15						mhm=filler							
A: And like we went into &Jackson, the town and we were like -- 	we=A and Kevin,town=Jackson		16	A and Kevin went into Jackson, the town						CT+ 16	CT+ 16	JA 16	JA 16			
A: -- %ah [[drawn out and in fright]] let me {laugh} out of here. You know it was like a traffic jam and all these stores and we sort of didn’t know what was coming. We were like oh my god traffic jams 	me=A and Kevin,we=A and Kevin		17.1	A and Kevin wanted to get out of Jackson					let me out of here=A and Kevin wanted to leave Jackson	CT+ 17.1	CT+ 17.1	JA 17.1	JA 17.1			
			17.2	A and Kevin got out of Jackson						CT- 17.2	CT- 17.2	RT 17.2	RT 17.2		want in past tense suggests that the embedded event did not happen	
			17.3	There was a traffic jam and stores in Jackson						CT+ 17.3	CT+ 17.3	JA 17.3	JA 17.3			
			17.4	A and Kevin didn't know what was coming					oh my god traffic jams=complaint about traffic jams	CT+ 17.4	CT+ 17.4	JA 17.4	JA 17.4			
			17.5	Something was coming						CT+ 17.5	CT+ 17.5	IN 17.5	IN 17.5		presupposed	
			17.6	A and Kevin complained about traffic jams						CT+ 17.6	CT+ 17.6	JA 17.6	JA 17.6			
B: {laugh} 			18						B laughs at 17.1, 17.3, 17.4, 17.6							
B: uh-huh.  			19						uh-huh=filler							
A: What kind of tourist hell is this? Get us out of here [[says laughing]].  	this=Jackson		20	Jackson is a kind of a tourist hell						CT+ 20	CT+ 20	IN 20	IN 20			
B: {laugh} 			21						B laughs at 20							
A: of course then we were like you know let’s stay here a couple days. [distortion]  	we=Kevin and A,here=Jackson		22	Kevin and A decided to stay in Jackson a couple of days					we were like=announcing a new event coming up; you know=assumption that B might know abnout the upcoming event; let's=decided	CT+ 22	CT+ 22	JA 22	JA 22			
B: {inhale} And now you guys have a five year old and 	you=Kevin and A		23	Kevind and A have a five year old 					now=presuppositon	CT+ 23	CT+ 23	IN 23	IN 23			
B: {laugh} yeah.  			24						yeah=filler							
A: This is kind of cute. oh look there’s the &Benneton outlet.  	This=Jackson,there=Jackson		25.1	Jackson is kind of cute.						CT+ 25.1	CT+ 25.1	JA 25.1	JA 25.1			
			25.2	There's the Bennton outlet in Jackson						CT+ 25.2	CT+ 25.2	JA 25.2	JA 25.2			
B: {sh} 			26													
B: oh you guys have really turned into yuppies, %huh? {laugh} 	you=Kevin and A		27	Kevin and A have really turned into yuppies						CT+ 27	CT+ 27	IN 27	IN 27		B seems to be stating something both speakers already believe	
A: Scary.  			28	27 is scary						CT+ 28	CT+ 28	JA 28	JA 28			
B: {laugh} {inhale} What we shouldn’t have a house in the suburbs.  	we=B and Norm		29.1	B and B's partner shouldn't have a house in the suburbs						CT+ 29.1	CT+ 29.1	JA 29.1	JA 29.1			
			29.2	B and B's partner have a house in the suburbs						CT- 29.2	CT- 29.2	RT 29.2	RT 29.2		should not in present tense negates the possibility of the embedded event beinng true (???)	
A: Well if I’m unemployed, if I’m unemployed I can’t be a {laugh} yuppie can I? 	I=A		30.1	A asks B if A can't be a yuppie if A is unemployed						CT+ 30.1	CT+ 30.1	JA 30.1	JA 30.1			
			30.2	A can't be a yuppie if A is unemployed		 → 33 PS	 → 33 JA	 → 33 CT+		PS 30.2	CT- 30.2	RT 30.2	RT 30.2		question tag, so PS got Bel: A; CT- for Bel: B because of 27	
			30.3	A can't be a yuppie						PS 30.3	CT- 30.3	RT 30.3	RT 30.3		CT- for Bel: B because of 27	
			30.4	A is unemployed						CT+ 30.4	CT+ 30.4	IN 30.4	IN 30.4			
B: {breath} 			31						indicates thinking about 30.2							
A: {inhale} Don’t I need to be professional? 	I=A		32.1	A asks if A needs to be a professional to be a yuppie						CT+ 32.1	CT+ 32.1	JA 32.1	JA 32.1			
			32.2	A needs to be a professional to be a yuppie			 → 33 JA			PS 32.2	NB 32.2					
			32.3	A is a yuppie		 → 33 PS		 → 33 CT+		CT- 32.3	CT+ 32.3				Bel: B CT+ because of 27; Bel: A implied from the question	
B: %um. yeah I guess.  	I=B		33						yeah I guess=expressing some belief about 30.2		PS 32.3,PS 30.2	JA 32.2,JA 30.2	JA 32.3,JA 30.2			
B: Well &Norm and I are worse because we live in the suburbs.  	I=B,we=Norm and B		34.1	Norm and B are worse because Norm and B live in the suburbs						CT+ 34.1	CT+ 34.1	JA 34.1	JA 34.1			
			34.2	Norm and B are worse					Norm and B are in a worse situation (???)	CT+ 34.2	CT+ 34.2	JA 34.2	JA 34.2			
			34.3	Norm and B live in the suburbs						CT+ 34.3	CT+ 34.3	JA 34.3	JA 34.3			
B: %uh so.  			35													
A: Well really silly we’ll save that for our self respects. So are you coming or not? Are you coming or not? Are you coming or not? [[drawn-out whining]] 	that=A and Kevin can't be yuppies,we=A and Kevin,you=B		36.1	Kevin and A will save A's impossibility of being a yuppie for Kevin's and A's self respect						CT+ 36.1	CT+ 36.1	JA 36.1	JA 36.1			
			36.2	A asks B if B is coming to visit A and Kevin or not						CT+ 36.2	CT+ 36.2	JA 36.2	JA 36.2			
			36.3	B is coming to visit A and Kevin						PS 36.3	PS 36.3	JA 36.3	JA 36.3			
			36.4	B is not coming to visit A and Kevin						PS 36.4	PS 36.4	JA 36.4	JA 36.4		based on B's answer in 37.1	
B: I don’t know. It’s up to my husband. Hopefully he’ll finish soon and %uh -- 	I=B,It=B's coming,husband=Norm,he=Norm		37.1	B doesn't know if B is coming to visit A and Kevin						CT+ 37.1	CT+ 37.1	JA 37.1	JA 37.1		events embedded under 'don't know' will always be PS?	
			37.2	B's coming is up to Norm			 → 40 IN	 → 40 CT-		CT+ 37.2	CT+ 37.2	JA 37.2	JA 37.2			
			37.3	Norm will hopefully finish soon		 → 39.3 CT-				CT- 37.3	CT+ 37.3	RT 37.3	RT 37.3		In 39.1 A discloses A's CT- belief about 37.3	
B: -- and %um  			38													
A: I thought you said he was finished.  	I=A,you=B,he=Norm		39.1	A thought B said Norm was finished						CT+ 39.1	CT+ 39.1	JA 39.1	JA 39.1			
			39.2	B said Norm was finished						PS 39.2	CT+ 39.2	 39.2	 39.2		Bel:B CT+ from B's response in 43; Bel:A is PS because 39.2 is embedded under 'think'	
			39.3	Norm was finished	 → 41 CT+		 → 41 JA	 → 41 CT+		PS 39.3	CT+ 39.3,CT- 37.3	 39.3	 39.3		Bel:A PS because embedded under 'said'; this is hard-- we need to talk about CG updates. IMO 39.2 and 39.2 were already IN, but now A expresses some doubts -- at the moment we have no way to describe the status of their CG -- should be someting like re-enterntaining an event	
B: You know I mean  			40									IN 37.2	IN 37.2		B communicates that A should know about 37.2 already	
B: yeah he is finished.  			41							CT+ 39.3		JA 39.3	JA 39.3			
A: I thought you said he did send it today.  	I=A,he=Norm,you=B,it=Norm's thesis?		42.1	A thought B said Norm did send Norm's thesis today						CT+ 42.1	CT+ 42.1	JA 42.1	JA 42.1			
			42.2	B said Norm did send Norm's thesis today						PS 42.2	CT+ 42.2				event ebedded under 'think' -- expresses some doubt for Bel: A; Bel: B is sure of what B said -- confrmation in 43.1, so CT+	
			42.3	Norm did send Norm's thesis today						PS 42.3	CT+ 42.3				same reasoning as above for Bel; for CG --blank for the moment	
B: He is finished. He just has to defend.  	He=Norm		43.1	Norm is finished with Norm's thesis						CT+ 43.1	CT+ 43.1	IN 43.1	IN 43.1			
			43.2	Norm just has to defend Norm's thesis						CT+ 43.2	CT+ 43.2	JA 43.2	JA 43.2			
B: So I don’t know. We’ll see what happens. I’ll talk to him today. He has a job so.  If not when are you guys moving? 	We=B and Norm,I=B,him=Norm,He=Norm,you=A and Kevin		44.1	B doesn't know if B is coming to visit A and Kevin because Norm still has to defend Norm's thesis						CT+ 44.1	CT+ 44.1	JA 44.1	JA 44.1			
			44.2	B and Norm will see what happens						CT+ 44.2	CT+ 44.2	JA 44.2	JA 44.2		maybe we also want: 'Something will happen' event?	
			44.3	B will talk to Norm today						CT+ 44.3	CT+ 44.3	JA 44.3	JA 44.3			
			44.4	Norm has a job					so=B indicates that 44.4 is known and this is the reason why she cannot talk to him now(??)	CT+ 44.4	CT+ 44.4	IN 44.4	IN 44.4			
			44.5	B asks A when A and Kevin are moving					if not=unfinished sentence	CT+ 44.5	CT+ 44.5	JA 44.5	JA 44.5			
			44.6	A and Kevin are moving						CT+ 44.6	CT+ 44.6	IN 44.6	IN 44.6			
A: We’re not moving for a year.  	We=Kevin and A		45	Kevin and A are not moving for a year						CT+ 45	CT+ 45	JA 45	JA 45			
B: oh okay. Good.  			46						good=B expresses content about 45; it is implied that B has plenty of time to visit Kevin and A							
B: {breath} 			47													
A: We won’t move till 	We=Kevin and A		48													
B: okay.  			49													
A: %mm [[drawn out]]  			50						mm=indicates A's thought process (calculation perhaps)		 50					
A: probably June.  			51	Kevin and A won't move till probably June						CT+ 51	CT+ 51	JA 51	JA 51			
B: okay.  			52						B approves of 51							
A: Maybe early June.  			53	Kevin and A won't move till maybe early June					A corrected herself about 51							
B: Because if I don’t come when &Norm does his defense 			54												skipped event here -- seems like B is forming B's thoughts on the spot -- no content-wise contribution to the dialog	
A: uh-huh, uh-huh.  			55													
B: which I really want to come for that but you know I have 	I=B		56	B really wants to come to Norm's defense						CT+ 56	CT+ 56	JA 56	JA 56			
B: I might not be able to for other reasons {inhale}.  	I=B		57	B might not be able to come for Norm's defense for other reasons  						CT+ 57	CT+ 57	JA 57	JA 57			
A: uh-huh.  			58						uh-huh=filler, to sustain the flow of the conversation							
B: But if I can’t come then then I’m going to stop in January. Well I’ll probably stop in January anyhow.  	I=B,then=???		59.1	If B can't come then, B is going to stop in January						CT+ 59.1	CT+ 59.1	JA 59.1	JA 59.1			
			59.2	B can't come then						PS 59.2	PS 59.2	JA 59.2	JA 59.2		the possibility of 59.2 is added to CG	
			59.3	B is going to stop in January						PS 59.3	PS 59.3	JA 59.3	JA 59.3			
			59.4	B will probably stop in January anyhow						CT+ 59.4	CT+ 59.4	JA 59.4	JA 59.4		does not reject 59.3  -- two different events	
A: Excellent 			60						Excellent=A expressses excitmement about 59.3	CT+ 60	CT+ 60					
B: {inhale} Because I’m going to %uh (( )) in January with the baby to %uh -- 	I=B,baby=B's baby		61													
B: -- see the %uh -- 			62													
B: -- the it’ll come out to see the relatives.  			63	B is going to see relatives with B's baby						CT+ 63	CT+ 63	JA 63	JA 63			
A: Show off <French ((le bebe))>.  			64	B is going to show off B's baby			 → 65 IN	 → 65 CT-		CT+ 64	CT+ 64	JA 64	JA 64			
B: yeah. Show off <French ((le bebe))>.  			65									IN 64	IN 64			
A: Excellent  			66						Excellent= A expresses content about 63 and 64							
B: Do you think ei- I mean eight weeks is not really well it’ll, it’ll be older than eight weeks it’ll be like ten weeks by then. That’s not too early to travel is it? 	then=the time when B and B's baby visit the relatives,you=A,it=B's baby		67.1	B's baby will be older than eight weeks by the time B and B's baby visit the relatives						CT+ 67.1	CT+ 67.1	JA 67.1	JA 67.1			
			67.2	B's baby will be like ten weeks by the time B and B's baby visit the relatives						CT+ 67.2	CT+ 67.2	JA 67.2	JA 67.2		67.1 and 67.2 are not mutually exclusive	
			67.3	B asks if 10 month old baby is not too young to travel with					early=refers to B's baby's age	CT+ 67.3	CT+ 67.3	JA 67.3	JA 67.3			
			67.4	10 month old baby is not too young to travel with			 → 68 JA	 → 68 CT+		PS 67.4	CT+ 67.4				enternatining the event -- we must deferrentiate that from RT	
A: Nope.  			68									JA 67.4	JA 67.4			
B: I thought it would be like much easier to travel if we went when he was ten weeks than -- 	I=B,went=visited relatives,we=B and Norm		69													
A: yep, yep, yep. 			70												A respons before B finnishes B's thought, which is not uncommon in conversations. Followinng our current guideliness, we should wain until B is done	
B: -- you know after that.  	that=when B's baby is older		71.1	B thought it would be like much easier to travel if B and Kevin visited relatives when B's baby was ten weeks than when B's baby is older						CT+ 71.1	CT+ 71.1	JA 71.1	JA 71.1			
			71.2	It would be like much easier to travel if B and Kevin visited relatives when B's baby was ten weeks than when B's baby is older						CT+ 71.2	CT+ 71.2	JA 71.2	JA 71.2			
			71.3	It would be like much easier to travel to visit the relatives when B's baby was 10 weeks then when B's baby is older						CT+ 71.3	CT+ 71.3	JA 71.3	JA 71.3			
			71.4	B's baby was 10 weeks						CT- 71.4	CT- 71.4	RT 71.4	RT 71.4		not sure that this event is ever considered cognnitively  -- we need to differentiate between 'not enternatied' and 'entertained but rejected'	
A: when they’re new infants it’s like bring along a blanket so you can nurse them. And like you could do anything. You could probably go like do skydiving or something.  	they=babies,them=babies,it=travelling,you=one		72.1	When babies are infants travelling is just about bringing along a blanket so one can nurse the babies					like=indicates that the following event is simple?	CT+ 72.1	CT+ 72.1	JA 72.1	JA 72.1			
			72.2	Babies are infants						CT- 72.2	CT- 72.2	RT 72.2	RT 72.2			
			72.3	Travelling is just about bringing along a blanket so one can nurse the babies						CT- 72.3	CT- 72.3	RT 72.3	RT 72.3		once again, not sure if this reasoning is actually happening in our brains. I do find it useful to AI traininng purposes	
			72.4	One can nurse the babies 						CT+ 72.4	CT+ 72.4	JA 72.4	JA 72.4			
			72.5	One could do anything with a baby younger than ten months						CT- 72.5	CT- 72.5	RT 72.5	RT 72.5		sarcasm	
			72.6	One couldn't do everything with a baby younger than ten months						CT+ 72.6	CT+ 72.6	JA 72.6	JA 72.6		inference from 72.5	
			72.7	One could probably go like skydiving or something with a baby younger than 10 months						CT- 72.7	CT- 72.7	RT 72.7	RT 72.7		sarcasm	
			72.8	One could not probably go like skydiving or something with a baby younger than 10 months						CT+ 72.8	CT+ 72.8	JA 72.8	JA 72.8		inference from 72.7	
B: yeah. I know.  	I=B		73						yeah. I know.= B agrees with 72.1							
A: And if you were nursing the baby while you were skydiving the baby would be like okay.  	you=one,okay=go along with the skydiving		74.1	If one were nursing the baby while one was skydiving, the baby would go along with the skydiving						CT- 74.1	CT- 74.1	RT 74.1	RT 74.1		sarcasm -- I don;t think the nagtion of this would enter CG, would it ???	
			74.2	One was nursing the baby while skydiving						CT- 74.2	CT- 74.2	RT 74.2	RT 74.2		sarcasm	
			74.3	The baby would go along with the skydiving						CT- 74.3	CT- 74.3	RT 74.3	RT 74.3		sarcasm 	
B: yeah.  			75						yeah.  =B agrees with 74.1							
A: Alright. As long as we’re nursing while we’re doing this that’s okay.  	we=mothers,that=skydiving with babies,this=skydiving with babies		76.1	As long as mothers are nursing while skydiving, skydiving with babies is okay						CT- 76.1	CT- 76.1	RT 76.1	RT 76.1		sarcasm -- the joke continues	
			76.2	Mothers are nursing while skydiving						CT- 76.2	CT- 76.2	RT 76.2	RT 76.2		sarcasm	
			76.3	Skydiving with babies is okay						CT- 76.3	CT- 76.3	RT 76.3	RT 76.3		sarcasm	
B: That’s what I thought too.  	I=B		77						That’s what I thought too. = B has the same thought as 76.1							
B: {inhale} And they don’t need that many clothes when they’re that young. And they don’t need toys.  	they=babies under tenn months		78.1	Babies under ten months don't need that many clothes					that young=10 month old baby is very young	CT+ 78.1	CT+ 78.1	JA 78.1	JA 78.1			
			78.2	Babies under ten months don't need toys						CT+ 78.2	CT+ 78.2	JA 78.2	JA 78.2			
B: So.  			79													
B: You know basically you don’t need to bring anything.  	you=one,You=A		80	Basically one doesn't need to bring anyhing when travelling with babies udner ten months					result of 78.1 and 78.2	CT+ 80	CT+ 80	JA 80	JA 80			
B: {lipsmack} But %uh but you know your two boobs. {laugh} and %uh {sniff} 	your=one's		81						you know your two boobs = B implies that B has to bring at least B's boobs when travelling with B's baby							
A: {laugh} 			82													
B: And since I can’t really go anywhere without those anyhow {laugh} 	those=boobs,I=B		83	B can't really go anywhere without B's boobs anyhow					anyhow=no matter what one does	CT+ 83	CT+ 83	JA 83	JA 83			
A: They’re hard to forget 	They=boobs		84	Boobs are hard to forget						CT+ 84	CT+ 84	JA 84	JA 84		joke but not untrue statement	
B: {laugh} yeah.  			85						yeah=confiriming 84							
A: Hard to leave behind.  			86	Boobs are hard to leave behind						CT+ 86	CT+ 86	JA 86	JA 86			
B: yeah. So I mean in then you know then we can just use disposables if we’re travelling, so 	disposables=disposable boobs?,I=B,we=one		87.1	One can use disposable boobs if one were travelling						CT- 87.1	CT- 87.1	RT 87.1	RT 87.1		sarcasm	
			87.2	One can use disposable boobs						CT- 87.2	CT- 87.2	RT 87.2	RT 87.2		sarcasm	
			87.3	One were travelling						CT- 87.3	CT- 87.3	RT 87.3	RT 87.3		hypothetical	
A: oh definitely.  			88						oh definitely. =A confirms 87.1							
A: Don’t we did one time we were like we were travelling in the car we were like oh we can just bring a little mini diaper pail and all.  	we=A and Kevin		89.1	Kevin and A were travlleing in he car					we were like oh=Kevin and A thought that							
			89.2	Kevin A thought that Kevin and A can just bring a little mini diaper pail and all when travelling in the car						CT+ 89.2	CT+ 89.2	JA 89.2	JA 89.2			
			89.3	Kevin and A can just bring a little mini diaper pail and all when travelling in the car						CT+ 89.3	CT+ 89.3	JA 89.3	JA 89.3		or sarcasm and CT- and RT? Not sure what A means here	
B: yeah.  			90													
A: That was after one time I went never again.  	one=one time of travelling with non-disposable diapers (?),I=A		91	After one time of travelling with non-dsposable diapers A went never again.					A went never again=A will never repeat A's mistakes	CT+ 91	CT+ 91	JA 91	JA 91	C		
B: {laugh} 			92													
A: Disposables for travelling.  			93	Disposables are essential for travalling						CT+ 93	CT+ 93	JA 93	JA 93	C		
B: And did you %um 			94													
A: ((Absolutely)) [distortion].  			95													
B: Every now did you supplement nursing with bottles at all or didn’t, didn’t you? 	you=B		96.1	B asks A if A supplemented nursing with bottles						CT+ 96.1	CT+ 96.1	JA 96.1	JA 96.1	C		
			96.2	A supplemented nursing with bottles		 → 97 CT-	 → 97 RT	 → 97 PS		CT- 96.2	PS 96.2			LI	PS because 96.2 is embedded under a yes/no question	
A: No. No. Somehow like I read too many of the (( )) books so I thought it was like no formula.  	I=A		97	A read too many of the books so A thought it was like no formula					it was like no formula=A decided not to use formula	CT+ 97,CT+ 97	CT- 96.2,CT+ 97	RT 96.2,JA 97	RT 96.2,JA 97	C		
A: It does make a difference like I always thought formula smells kind of disgusting {inhale} 	I=A,It=formula vs breastmlik		98.1	Formula vs breastmilk does make a difference						CT+ 98.1	CT+ 98.1	JA 98.1	JA 98.1	C		
			98.2	A always thought formula smells like of disgusting						CT+ 98.2	CT+ 98.2	JA 98.2	JA 98.2	C		
			98.3	Formula smells kind of disgusting						CT+ 98.3	CT+ 98.3	JA 98.3	JA 98.3	LI	 even though 98.3 is embedded under 'think' it does express a certain belief	
B: oh yeah.  			99						oh yeah. =agreement with 98.3							
A: Like when they throw up it smells disgusting and when they make their little doo-doo’s it smells grosser if they’re on formula. But if they’re totally breast milk now you’ll find this hard this believe but if they’re totally breast milk for like the first couple months -- 	they=babies,it=vomits/doo-doo,you=A		100.1	Like when babies throw up, the vomits smell disgusting 					it is assumed that the babies' vomits smell disgusting when babies drink formula instead of milk	CT+ 100.1	CT+ 100.1	IN 100.1	IN 100.1	LI	"like" here indicates that the speaker speaks some general truth	
			100.2	Babies throw up						CT+ 100.2	CT+ 100.2	IN 100.2	IN 100.2			
			100.3	The vomits smells disgusting						CT+ 100.3	CT+ 100.3	JA 100.3	JA 100.3			
			100.4	When babies make babies' little doo-doos, the doo-doo smells grosser if the babies are on formula						CT+ 100.4	CT+ 100.4	JA 100.4	JA 100.4			
			100.5	Babies make babies little doo-doos						CT+ 100.5	CT+ 100.5	IN 100.5	IN 100.5	WK		
			100.6	The doo-doo smells grosser if the babies are on formula						CT+ 100.6	CT+ 100.6	JA 100.6	JA 100.6			
			100.7	The doo-doos smell grosser						NB 100.7	NB 100.7	RT 100.7	RT 100.7	C	It seems to me that the speakrs do not form any beliefs towars those individual events in 100.7 and 100.8. Mayne not needed at all?	
			100.8	Babies are on formula						NB 100.8	NB 100.8	RT 100.8	RT 100.8	C		
B: mhm.  			101													
A: they don’t their number twos don’t smell at all.  			102.1	If babies're totally breast milk for a couple of months, the babie's number twos don't smell						CT+ 102.1	CT+ 102.1	JA 102.1	JA 102.1	C	here, aleternatively I did not recognized the sub-events -- which is better?	
			102.2	B will find 102 hard to believe						CT+ 102.2	CT+ 102.2	JA 102.2	JA 102.2			
B: oh okay.  			103						oh okay=agreement with 102.1							
A: They don’t smell like anything. It’s like {sniffing} 	They=the babies who drink breast milk's doo-doos		104	The babies who drink breast milk's doo-doos don't smell like anything.						CT+ 104	CT+ 104	JA 104	JA 104			
A: it looks like shit but it doesn’t smell like anything {laugh}.  	it=doo-doo		105.1	The baby who drinks breast milk's doo-doo looks like shit but doesn't smell like anything						CT+ 105.1	CT+ 105.1	JA 105.1	JA 105.1			
			105.2	The baby who drinks breast milk's doo-doo looks like shit 						CT+ 105.2	CT+ 105.2	JA 105.2	JA 105.2			
			105.3	The baby who drinks breast milk's doo-doo doesn't smell like anything						CT+ 105.3	CT+ 105.3	JA 105.3	JA 105.3			
B: oh okay.  			106						oh okay=agreement with 105.1							
B: {inhale}And did you pump or not? 	you=A		107.1	B asks A if A pumped A's breastmilk						CT+ 107.1	CT+ 107.1	JA 107.1	JA 107.1			
			107.2	A pumped A's breastmilk		 → 108 CT+	 → 108 JA	 → 108 CT+		CT+ 107.2	PS 107.2			LI	PS because it;s yes/no question	
A: yeah I pumped. What joy that was.  	that=pumping		108	Pumping was a joy						CT+ 108	CT+ 107.2,CT+ 108	JA 107.2,JA 108	JA 107.2,JA 108	C	not sure if A is being sarcastic here. If yes, we need to reject this event and add its negation below	
